body,Positive Psychology,PP: Gratitude,PP: Optimism,PP: Strengths,PP: Meaning,PP: Positive Reappraisal,PP: Humor,PP: General Education,Physical Activity,Diet,Directive,Social
Time for a boost of positive thoughts and feelings! Take some time today to think about a successful event in your life and how you personally contributed to that success.,1,0,0,1,0,0,0,0,0,0,1,0
"Another simple way to improve your health is to reduce the amount of time you spend sitting down throughout the day. Today, try to be mindful of times when you are sitting for an hour or longer and get up and move around!",0,0,0,0,0,0,0,0,1,0,1,0
"At the end of the day today, think of one positive event from today and one positive thing you are looking forward to. You can ask a friend to do this with you, too!",1,1,1,0,0,0,0,0,0,0,1,1
"When it comes to physical activity, every little bit counts. How can you take a few extra steps today to increase your activity level and benefit your overall health? ",0,0,0,0,0,0,0,0,1,0,1,0
Research shows that having social support can make a big difference in achieving physical activity goals. Try telling a friend or family member today about your exercise goals!,0,0,0,0,0,0,0,0,1,0,1,1
"If you can, take some time today to stop and appreciate something positive. It could be an important friendship, a beautiful view, or another person's kind act. See how it feels!",1,1,0,0,0,0,0,0,0,0,1,0
Take some time today to think of a simple plan for how you can be more active. Make sure it is realistic and something you feel you can commit to for the next week (like walking for 20 minutes each day). Write it down and try to follow it for the next 7 days!,0,0,0,0,0,0,0,0,1,0,1,0
Exercise can boost your energy level so that you feel more energetic and motivated in general. What can you do today to exercise your body?,0,0,0,0,0,0,0,0,1,0,1,0
Research suggests that people who exercise more also live longer! It's never too late to start exercising. How about taking a walk today and making it a habit?,0,0,0,0,0,0,0,0,1,0,1,0
Did you know that exercise can help you grow new brain cells and improve your memory? Start exercising today to stay sharp!,0,0,0,0,0,0,0,0,1,0,1,0
You are more likely to stick with a physical activity routine if you enjoy what you are doing. It's helpful to try many different types of activity to find what you like most. You can start this week!,0,0,0,0,0,0,0,0,1,0,1,0
Physical activity is a great way to boost your mood. Try exercising for at least 15 minutes today and see if you feel any improvements in your mood or energy level!,0,0,0,0,0,0,0,0,1,0,1,0
What are some reasons why physical activity may be important to you? Can you think of something that motivates you to be more physically active today?,0,0,0,0,0,0,0,0,1,0,1,0
What are your barriers for physical activity? Can you brainstorm and write down a way to get around these potential barriers this week?,0,0,0,0,0,0,0,0,1,0,1,0
Sometimes social support can help you meet your physical activity goals. Try telling a friend or family member today about your goals and see if they can help you stay on track!,0,0,0,0,0,0,0,0,1,0,1,1
"For some people, exercise is more fun when it is done with other people. Try finding an exercise partner this week and see how it feels!",0,0,0,0,0,0,0,0,1,0,1,1
Setbacks are a normal part of progress and improvement. What matters most is that you don't give up! Can you think of a time when you had a setback but did not give up? Use this memory as motivation to meet your physical health goals!,0,0,0,0,0,0,0,0,1,0,1,0
"Sitting for long periods of time can lead to reduced strength and energy. Today, try to stand up every 30 minutes and move around!",0,0,0,0,0,0,0,0,1,0,1,0
"People often focus on negative events rather than the good, positive things that happen. Today, try to notice three good things to promote gratitude and optimism!",1,1,1,0,0,0,0,0,0,0,1,0
"Research indicates that life satisfaction depends less on actual events and more on what we choose to pay attention to. Today, try to focus on the positive and write down three things for which you feel gratitude!",1,1,0,0,0,0,0,0,0,0,1,0
Think back over the last several years and remember an instance when someone did something nice for you. Consider writing or calling them to express your gratitude today!,1,1,0,0,0,0,0,0,0,0,1,1
"Today, think about a success you have had in your life and spend time savoring how it felt to achieve this success and how you played a role in making it happen. See if you can use this experience to build your confidence and motivation going forward!",1,0,0,1,0,0,0,0,0,0,1,0
Tracking your physical activity can be very motivating and helpful for achieving your goals. Consider using a calendar to mark off the days you are active and record how many minutes you spent being active!,0,0,0,0,0,0,0,0,1,0,1,0
One way to stay more focused on the positive aspects of your life is to use a calendar to write down one thing you are grateful for each day. Try this out today!,1,1,0,0,0,0,0,0,0,0,1,0
Scientific research suggests that performing small acts of kindness can improve your mood and how you think about yourself. Think about what you can do today to be kind to someone else!,1,0,0,0,1,0,0,0,0,0,1,0
Is there someone in your life who motivates you to be healthier? Can you spend time with them or reach out to them today?,0,0,0,0,0,0,0,0,0,0,1,1
"It is often easier to add new healthy foods into your diet rather than cutting out the unhealthy foods all at once. Today, try to add some healthy foods into your meals like a large serving of vegetables!",0,0,0,0,0,0,0,0,0,1,1,0
"Soda and fruit juice can contain a great deal of sugar and can actually make you feel more tired rather than energized. Instead, try to find a healthier replacement today like water, coffee, or tea!",0,0,0,0,0,0,0,0,0,1,1,0
"A great way to eat healthy is to eat foods that are fresh and natural, like vegetables, fruits, nuts, beans, or fish. Is there a healthy, natural food you would like to eat today?",0,0,0,0,0,0,0,0,0,1,1,0
Vegetables are the healthiest food group by far. Try to eat some vegetables with each meal today if you can!,0,0,0,0,0,0,0,0,0,1,1,0
"The hungrier we are when choosing food, the harder it can be to choose a healthy option. If you can, try to plan your meals ahead of time when you aren't feeling hungry!",0,0,0,0,0,0,0,0,0,1,1,0
"Stress can have a harmful effect on your physical health over time. Today, when you feel worried, try taking deep, slow breaths and focus your attention only on what is within your control to change.",0,0,0,0,0,0,0,0,0,0,1,0
"It can be helpful to remember that almost everyone you meet is facing some kind of internal struggle. Today, try to be especially kind and understanding to others…and to yourself!",1,0,0,0,0,0,0,1,0,0,1,1
Making a list of your favorite healthy foods and having them easily available at home can help keep you on track in terms of a healthy diet. Can you make a list of your favorite healthy foods today?,0,0,0,0,0,0,0,0,0,1,1,0
The simplest way to improve your diet is to fill your plate with more vegetables for each meal. Try to increase the amount of vegetables you eat this week by 20%!,0,0,0,0,0,0,0,0,0,1,1,0
"Be careful of foods like white bread that are made of simple carbohydrates. Try to use foods rich in complex carbohydrates instead like whole wheat breads, whole grain crackers, or brown rice!",0,0,0,0,0,0,0,0,0,1,1,0
"Some fats are actually good for you! Olive oil, soybeans, nuts, or avocados are all examples of healthy fats. ",0,0,0,0,0,0,0,0,0,1,0,0
"It is a good idea to avoid foods with ""partially hydrogenated"" oils listed as an ingredient. Partially hydrogenated oils can be found in certain types of synthetic butters or other processed foods!",0,0,0,0,0,0,0,0,0,1,0,0
Fish is generally healthier than red meats like beef. Try to add more fish into your diet for a healthier future!,0,0,0,0,0,0,0,0,0,1,1,0
A good cooking tip is to season foods with herbs and spices instead of salt. Your food will still be tasty but will be much healthier as well!,0,0,0,0,0,0,0,0,0,1,0,0
Today's nutrition tip for a healthy heart: stay away from any foods that contain more than 140mg of sodium (salt) per serving!,0,0,0,0,0,0,0,0,0,1,0,0
Some canned or processed foods can contain high levels of salt. Look for sodium on the nutrition information label and be careful if it says there are more than 140mg of sodium per serving!,0,0,0,0,0,0,0,0,0,1,0,0
"Here is a healthy eating tip: try to have fresh fruit for dessert instead of baked goods, puddings, or sweets made with cream or sauces!",0,0,0,0,0,0,0,0,0,1,0,0
"It can be difficult to eat healthy foods when ordering from fast food restaurants. This week, try to limit the number of times you eat fast food this week and replace these meals with healthier alternatives!",0,0,0,0,0,0,0,0,0,1,1,0
"Some of the best choices for healthy protein include beans, fish, egg whites, tofu/soy, and nuts. Try to have one of these great protein sources this week!",0,0,0,0,0,0,0,0,0,1,1,0
Write down your three favorite vegetables and buy one of them today to snack on during the week!,0,0,0,0,0,0,0,0,0,1,1,0
"Physical activity can lower blood pressure and ""bad"" cholesterol levels and can help you lose weight. Try to find a way to be active today!",0,0,0,0,0,0,0,0,1,0,0,0
"It possible, try using positive self-talk to turn negative thoughts into more positive ones. For example, when you catch yourself thinking, ""I can't do this,"" try saying ""I'll do the best I can"" instead!",0,0,0,0,0,0,0,0,0,0,1,0
"To help reduce stress and promote relaxation, try taking 15 to 20 minutes today to sit quietly, relax, breathe deeply in a peaceful environment. Notice how you feel afterward!",0,0,0,0,0,0,0,0,0,0,1,0
"Reducing physical tension in your body can help alleviate mental tension as well. Try to walk, bike, do yoga, or exercise in another way to help calm your mind today!",0,0,0,0,0,0,0,0,0,0,1,0
"If walking was a medication, doctors would write prescriptions for it all the time! Take a walk today for its many health benefits.",0,0,0,0,0,0,0,0,1,0,1,0
Delete - duplicate,0,0,0,0,0,0,0,0,0,0,,0
"Today, try to reach for healthy foods first when you are hungry instead of indulging in less healthy, comfort foods!",0,0,0,0,0,0,0,0,0,1,1,0
One of the easiest ways to exercise is to start walking on a regular basis. Walking is good for everyone!,0,0,0,0,0,0,0,0,1,0,0,0
"To bring yourself a greater sense of calm and motivation today, try quietly meditating or praying for five minutes. It will not take too much time out of your day, and you might notice a major mood change!",0,0,0,0,0,0,0,0,0,0,1,0
What activities make you feel most calm and peaceful? Can you try one of these activities today?,0,0,0,0,0,0,0,0,0,0,1,0
"Today, try to practice deep, slow breathing for two minutes while closing your eyes. Do you feel calmer or more at peace afterwards?",0,0,0,0,0,0,0,0,0,0,1,0
"To reduce stress, try writing down or thinking about a more positive way to look at something you have been struggling with lately.",0,0,0,0,0,0,0,0,0,0,1,0
"It is easy to become stressed out during the day without realizing it. Today, try to take a break from what you are doing for even one minute, close your eyes, and breathe deeply.",0,0,0,0,0,0,0,0,0,0,1,0
Is there a peaceful place near where you live that you could visit today or tomorrow? Purposefully seeking out peace in itself can be calming.,0,0,0,0,0,0,0,0,0,0,1,0