body,Positive Psychology,PP: Gratitude,PP: Optimism,PP: Strengths,PP: Meaning,PP: Positive Reappraisal,PP: Humor,PP: General Education,Physical Activity,Diet,Directive,Social
"When making changes to your diet, it can be easy to become frustrated if you assume that you can never enjoy your favorite foods again. Try to avoid this kind of black-or-white thinking and remember that almost any food is ok for you in moderation!",0,0,0,0,0,0,0,0,0,1,1,0
"It's natural to try to compare yourself to others, but this is not always helpful. If you're feeling discouraged about your health compared to those around you, just focus on the many positive changes you've already made in your life!",1,0,0,0,0,1,0,0,0,0,1,0
Tracking what you eat every day is a great way to be more aware of your diet. Try keeping a food diary so you can see where you are doing well and where you can make improvements.,0,0,0,0,0,0,0,0,0,1,1,0
"Tracking what you eat every day is a great way to be more aware of your diet. If you like using phone apps, try MyFitnessPal or other similar apps that allow you to track your daily calories in an easy and quick way!",0,0,0,0,0,0,0,0,0,1,1,0
"Food packaging often has a lot of helpful information. First, look at the serving size; often, one serving is only a portion of the package and not the whole thing. Next, focus on the calories and carbohydrates per serving and note these in your food diary!",0,0,0,0,0,0,0,0,0,1,1,0
"It is always helpful to check the nutrition label on snacks and meals. While high amounts of fiber, protein, and vitamins are beneficial, you want to make sure that you are limiting your intake of carbohydrates, fat, and sodium.",0,0,0,0,0,0,0,0,0,1,0,0
"Keeping track of your food can feel like a time-consuming chore with your busy schedule. Try keeping a piece of paper or a phone app on hand to make tracking faster after each meal. Alternatively, you can take a picture of your meal before you eat so you can record it later!",0,0,0,0,0,0,0,0,0,1,1,0
"Keeping track of your food can feel like a time-consuming chore, especially when you have to make note of your food several times per day. Try setting reminders on your phone or watch; soon, it will just feel like a normal part of your regular routine!",0,0,0,0,0,0,0,0,0,1,1,0
"Getting started with a new exercise routine can feel really intimindating! Try starting with short, low-intensity exercises such as taking a walk around the block. Then, work up gradually in intensity as you feel yourself getting stronger!",0,0,0,0,0,0,0,0,1,0,1,0
Setting goals can be really helpful in establishing a new routine. Try setting exercise goals for yourself based on your own personal fitness level. Your goals should be challenging yet realistic so you don't get discouraged!,0,0,0,0,0,0,0,0,1,0,1,0
"You don't need fancy machines or weights to build your muscles. Try strength training with body weight exercises like squats, push-ups, or lunges in the comfort of your own home!",0,0,0,0,0,0,0,0,1,0,1,0
"Fitting exercise into your busy day can be a challenge! There are often simple changes that you can try that will make a big difference. For example, try waking up just 30 minutes earlier or leaving a few minutes after dinner to fit in a walk.",0,0,0,0,0,0,0,0,1,0,0,0
"A simple way to add exercise into your schedule is to walk or bike places instead of driving. If it's possible, try walking or biking to work or when doing errands to increase your daily physical activity!",0,0,0,0,0,0,0,0,1,0,1,0
Most of us spend more time analyzing bad events rather than savoring and appreciating positive events. Focusing on the positive is a skill that takes time and practice. Try to reflect on three positive moments from your day today!,1,1,0,0,0,0,0,0,0,0,1,0
"Even during difficult times, it is often possible to recognize positive moments. Recognize and face your challenges today with determination but also try to note and appreciate the small, positive moments along the way!",1,1,0,0,0,0,0,0,0,0,1,0
"Take time today to reflect on one positive thing that has happened and think about how it made you feel. If you write it down, you may experience an even bigger boost of joy from the simple act of recording it!",1,1,0,0,0,0,0,0,0,0,1,0
"People often remember negative events more easily than positive events. Today, try to balance this out by purposefully focusing more on the good parts of your day rather than the negative parts!",1,1,0,0,0,0,0,0,0,0,1,0
"Focusing on bad events can help us learn from them and avoid similar situations in the future. However, don't forget to savor and appreciate the good events as well so you can have more of them in the future!",1,1,0,0,0,0,0,0,0,0,0,0
"It is common to spend more time focusing on our shortcomings rather than our strengths. Today, remind yourself of one of your personal strengths and brainstorm a way to use this personal strength in a new way this week!",1,0,0,1,0,0,0,0,0,0,1,0
"Having a sense of mastery or expertise over something can feel really good. Today, do something that you are good at to remind yourself of your abilities!",1,0,0,1,0,0,0,0,0,0,1,0
"Reflecting on personal strengths can help you realize just how remarkable your abilities are. Today, try using a talent or strength that you haven't thought about in awhile!",1,0,0,1,0,0,0,0,0,0,1,0
"Using our unique personal strengths can boost self-esteem, increase energy, reduce stress, and increase feelings of productivity. Use a personal strength today to give youreself a boost of energy!",1,0,0,1,0,0,0,0,0,0,1,0
We often don't give ourselves enough credit for our skills and expertise. Spending more time thinking about your strengths can help you remember to give yourself the credit you deserve!,1,0,0,1,0,0,0,0,0,0,0,0
A personal strength is a quality that feels genuine to who you are as a person. Identify a personal strength and use it today to put yourself back in touch with who you feel you truly are.,1,0,0,1,0,0,0,0,0,0,1,0
"Choose and use one of your many personal strengths today! Possibilities include curiosity, love of learning, bravery, persistence, honesty, love, or teamwork.",1,0,0,1,0,0,0,0,0,0,1,0
"Choose and use one of your many personal strengths today! Possibilities include fairness, leadership, humility, self-control, appreciation of beauty and excellence, humor, or spirituality.",1,0,0,1,0,0,0,0,0,0,1,0
"The more you can use your personal strengths in new or different ways, the greater the boost of happiness or confidence you might get in return!",1,0,0,1,0,0,0,0,0,0,0,0
Research shows that life satisfaction depends less on actual events and more on what we choose to pay attention to. Write down three things that you are grateful for today!,1,1,0,0,0,0,0,0,0,0,1,0
Writing a short thank you note to express your gratitude for another person's kindness can help remind you of how good people can be. Try it today!,1,1,0,0,0,0,0,0,0,0,1,1
Think back over the last several years and recall an instance when someone did something for you for which you are grateful. Consider writing a note or calling them to thank them today!,1,1,0,0,0,0,0,0,0,0,1,1
Think of someone who has been especially kind to you but who has never heard you fully express your gratitude. Consider thanking them today with an email or phone call!,1,1,0,0,0,0,0,0,0,0,1,1
"When something good happens today, try to capitalize on it by sharing what happened with loved ones, recording the event, or celebrating it in some way!",1,1,0,0,0,0,0,0,0,0,1,1
Celebrations don't have to be reserved only for major events. Try to celebrate something small today for which are grateful and see if it boosts your mood!,1,1,0,0,0,0,0,0,0,0,1,0
You can boost the enjoyment of something positive today by sharing what happened with a friend or a loved one. Sharing your joy can magnify it!,1,1,0,0,0,0,0,0,0,0,1,1
"Today, reflect on a past success. Think about how it felt to achieve your success and how you played a role in making it happen. Remembering past successes can boost confidence and motivate you to achieve more!",1,0,0,1,0,0,0,0,0,0,1,0
Remembering past successes is not always easy. Try reminding yourself of your capabilities and strenghts by visualizing a past success today!,1,0,0,1,0,0,0,0,0,0,1,0
Recalling a past success and identifying how you contribued to the achievement can help you understand how you can succeed again in the future. What past success can you use to motivate you today?,1,0,0,1,0,0,0,0,0,0,1,0
"Our personal strengths, past successes, and accomplishments are important aspects of our identity and our lives. Reflecting on these can boost mood and show us how we can achieve more success in the future!",1,0,0,1,0,0,0,0,0,0,0,0
"A past success can be large or small, public or private. Think of a success you've had in the past and the skills and qualities you used to make it happen. You can use these skills and qualities again to make a difference in your life!",1,0,0,1,0,0,0,0,0,0,1,0
"Today, think of a past success. How did you achieve it? How did it feel when you accomplished it? Most importantly, how can you use your strengths and skills again to achieve more success?",1,0,0,1,0,0,0,0,0,0,1,0
Thinking of a past success can remind you that you have the skills to be successful again in the future. Take a moment today to remember something you have accomplished and how that experience can help you achieven more!,1,0,0,1,0,0,0,0,0,0,1,0
"Research has shown that variety and novelty (newness) are important for leading a satisfying life. Today, do something totally new or try making an old activity new and interesting!",1,0,0,0,1,0,0,0,0,0,1,0
"Try to have a good mix of enjoyable and meaningful activities in your life. Can you do something that's either fun or meaningful today? What might you need more of today, enjoyment or meaning?",1,0,0,0,1,0,0,0,0,0,1,0
A great way to boost your mood is to engage in fun or meaningful activities. What can you do? Schedule in an activity on your calender for later today or this week if you can!,1,0,0,0,1,0,0,0,0,0,1,0
"Enjoyable activities can be done both alone and with others. If you've been doing more activities alone lately, try to do something fun with someone else today and vice versa!",1,0,0,0,1,0,0,0,0,0,1,1
"Sometimes doing an enjoyable or meaningful activity on your own can help you feel more energized and motivated. Today, try to do something alone that you love or something that brings you peace!",1,0,0,0,1,0,0,0,0,0,1,0
Doing an enjoyable or meaningful activity with others can help you feel more connected and foster joy for multiple people at the same time. Try to schedule something today or tomorrow with friends or loved ones!,1,0,0,0,1,0,0,0,0,0,1,1
Happiness is best found when engaging in enjoyable and meaningful activities. Try to schedule one of each for later this week!,1,0,0,0,1,0,0,0,0,0,1,0
A meaningful activity is one that enhances the sense of meaning and purpose for your life. Can you schedule something meaningful to do today or tomorrow?,1,0,0,0,1,0,0,0,0,0,1,0
"One way to bring more joy into your life is to fill your life with the activities that bring you the most happiness. Today, try to do something you love to multiply your joy! ",1,0,0,0,1,0,0,0,0,0,1,0
"Just thinking about happiness does not always make you happier. Instead, try engaging in something that makes you happy in an active way. What is something that you love that you can do today?",1,0,0,0,1,0,0,0,0,0,1,0
"Humor can lighten the mood, help you feel relaxed, and relieve stress by distracting you from your worries. Try to look at something in your life today with humor and see if you feel any positive benefits!",1,0,0,0,0,0,1,0,0,0,1,0
Humor can bring joy and enrich our lives. Having a sense of humor can also help us cope with life's challenges and make the best of situations. How can you use humor to bring joy to your life today?,1,0,0,0,0,0,1,0,0,0,1,0
Laughter is contagious and can strengthen our social connections. What makes you laugh? How can you bring more humor to yourself and your loved ones today?,1,0,0,0,0,0,1,0,0,0,1,1
"Humor can bring joy and enrich our lives, but it does not always have to be so obvious that it makes us laugh out loud. Anything strange or amusing or anything that makes you smile can bring positive benefits. Look for a little humor in your life today!",1,0,0,0,0,0,1,0,0,0,1,0
"If used correctly, humor can help you cope with stress. A smile or laugh can improve your mood and may even boost your physical health!",1,0,0,0,0,0,1,0,0,0,0,0
"Being able to find humor during difficult times is a hard thing to do but can be a good way to manage stress. If you are able to see the humor, it may also boost your mood and motivation.",1,0,0,0,0,0,1,0,0,0,1,0
"Sometimes it is true that ""laughter is the best medicine."" Write yourself a prescription for humor to get through both the good times and the bad!",1,0,0,0,0,0,1,0,0,0,1,0
"Today, try to identify the humorous side of something that happens. Whether you laugh, smile, or are simply mindful of the humor in life, it might help you get through the day!",1,0,0,0,0,0,1,0,0,0,1,0
Being kind and generous can lead you to see others in a more positive light and can foster a sense of community. Do one small act of kindness for another person today and see how it feels!,1,0,0,0,1,0,0,0,0,0,1,1
Doing kind acts can help you appreciate your own good fortune. Try to do something nice for someone today and see how it feels!,1,0,0,0,1,0,0,0,0,0,1,1
Being kind to someone else can be a welcome distraction from your own troubles and can put things in perspective. Try to do something kind for a friend or stranger today!,1,0,0,0,1,0,0,0,0,0,1,1
"A major benefit of being kind to others is that it can boost your self-esteem and change how you see yourself. Do something kind for someone else today, and you might just get a boost of positivity in return!",1,0,0,0,1,0,0,0,0,0,1,1
"When you are kind to others, you may begin to view yourself as a person who is kind and caring. Try to do one small act of kindness today!",1,0,0,0,1,0,0,0,0,0,1,1
"Studies find that helping others or volunteering for a good cause can help people better understand their own abilities, resources, and expertise. Try to help someone today, even in a small way!",1,0,0,0,1,0,0,0,0,0,1,1
"When people help others, they often feel that they have greater control over their own lives. Try to do something kind today for someone else and see how it feels!",1,0,0,0,1,0,0,0,0,0,1,1
Doing something kind for someone else can help restore your energy after a difficult situation or help you replace negative thoughts with more positive ones. Try doing something kind for someone today!,1,0,0,0,1,0,0,0,0,0,1,1
"You may already do kind things for other people on a regular basis. If so, today, try to do something kind for someone in a way that you've never tried before!",1,0,0,0,1,0,0,0,0,0,1,1
"Take a moment today to reflect on a kind act you have done for someone else in the past. Now, try to think of a small kind act you can do for another person in the future!",1,0,0,0,1,0,0,0,0,0,1,0
Performing an act of kindness for someone else can bring you feelings of joy or satisfaction. Try to do something kind for someone today. Don't worry about whether they will appreciate it; just enjoy yourself!,1,0,0,0,1,0,0,0,0,0,1,1
"As an act of kindness, give someone a genuine compliment today. See how it feels to let a person know that you value his/her good qualities!",1,0,0,0,1,0,0,0,0,0,1,1
"During difficult times, it is natural to think that you would be happier if only the circumstances changed. Today, if you find yourself in a difficult spot and you can't change the circumstances, try to change your attitude and think more positive thoughts!",1,0,0,0,0,1,0,0,0,0,1,0
"Performing intentional activities to promote happiness can be powerful, regardless of what challenges are present in your life. Schedule an activity today that can bring you joy or a greater sense of meaning!",1,0,0,0,0,0,0,1,0,0,1,0
Experiencing more positive emotions is a lot like learning a new expertise; it takes daily and deliberate practice to cultivate the right skills. Observe one positive emotion today and determine what caused it so you can experience it again!,1,0,0,0,0,0,0,1,0,0,1,0
Being happier can help people to engage in healthier behaviors such as being physically active or eating healthier foods. Think of something that makes you happy and use it as fuel to improve your life!,1,0,0,0,0,0,0,1,0,0,1,0
"Today, if you notice yourself having frequest negative thoughts, try to turn your mind back to the present moment and focus on the positive instead.",1,0,0,0,0,1,0,0,0,0,1,0
Engaging in activities that are out of the ordinary can be fulfilling and boost positive emotions. Try a new enjoyable activity or pick a new way to be kind to someone else today and see how you feel!,1,0,0,0,1,0,0,0,0,0,1,0
"If you plan the positive activities you will do ahead of time, you will feel positive in anticipation of the activity, during the activity, and afterwards! What can you plan for today?",1,0,0,0,0,0,0,1,0,0,1,0
"There are many positive feelings other than just ""good"" or ""happy."" The better you can become at describing exactly what positive emotion you are feeling (e.g., joy, inspiration, etc.), the more you can realize how bountiful they are!",1,0,0,0,0,0,0,1,0,0,0,0
"Here are 12 common positive emotions: gratitude, love, hope, determination, acceptance, pride, relief, serenity, interest, connectedness, inspiration, and joy. How can you cultivate one of these feelings?",1,0,0,0,0,0,0,1,0,0,0,0
"Research suggests that up to 50% of your happiness is under your own control. Today, purposefully do an activity that brings you well-being or joy!",1,0,0,0,0,0,0,1,0,0,1,0
Research has shown that physical activity is a great way to improve your mood. Try exercising today and notice how you feel afterwards!,0,0,0,0,0,0,0,0,1,0,1,0
A regular exercise routine can boost your overall energy levels. What can you do today to be physically active?,0,0,0,0,0,0,0,0,1,0,1,0
Regular exercise can improve your immune system and make it less likely that you will get sick. Try to boost your physical health with some kind of physical activity today!,0,0,0,0,0,0,0,0,1,0,1,0
Exercise can improve focus and make the brain work better. How can you be active today to improve both your body and your mind?,0,0,0,0,0,0,0,0,1,0,1,0
Did you know that exercise can help you grow new brain cells and improve your memory? Add in more exercise to your routine and see if your mind feels sharper!,0,0,0,0,0,0,0,0,1,0,0,0
"Exercise, even walking, can help keep your muscles strong and your body healthy. What can you do today to be active and keep your muscles strong?",0,0,0,0,0,0,0,0,1,0,1,0
Our muscles can lose strength rapidly when we don't use them. Regular exercise can prevent this and keep your muscles strong and healthy!,0,0,0,0,0,0,0,0,1,0,0,0
Exercise can improve circulation so that you will have better blood flow to your whole body. Can you take a walk today to get your blood flowing?,0,0,0,0,0,0,0,0,1,0,1,0
"The heart is a big muscle, and like all muscles, it needs exercise to stay strong. Take a walk today to keep your hearth strong and healthy!",0,0,0,0,0,0,0,0,1,0,1,0
"If losing weight is one of your goals, remember that one of the best ways to control weight is to take a walk or exercise in some other way every day. What can you do to be active today?",0,0,0,0,0,0,0,0,1,0,1,0
People who exercise more live longer. It's never too late to start being active! Do you want to take a walk today and set a goal to make it a habit?,0,0,0,0,0,0,0,0,1,0,1,0
"Despite knowing that exercise has many benefits, it can be hard to get motivated to be active every day. Can you think of one way to be more active today?",0,0,0,0,0,0,0,0,1,0,1,0
You are more likely to stick with an exercise routine if you enjoy the type of activity you are doing. It's always helpful to try many different types of physical activity to see what you like the most!,0,0,0,0,0,0,0,0,1,0,0,0
How important is physical activity to you? What motivates you to be more physically active? Can you think of a reason to be active today?,0,0,0,0,0,0,0,0,1,0,1,0
"Knowledge is power! By tracking your physical activity, you can learn more about what motivates you or what makes it less likely that you will be active on any given day. Try tracking your activity today!",0,0,0,0,0,0,0,0,1,0,1,0
"Pedometers, step-counters, smartwatches, and even phones can help you measure and track your physical activity goals. Can you use one of these today to see how many steps you take?",0,0,0,0,0,0,0,0,1,0,1,0
Developing a system to track your physical activity can make it easier to establish an exercise routine. How can you start tracking today?,0,0,0,0,0,0,0,0,1,0,1,0
Sometimes we don’t realize how much time we spend sitting without moving our bodies very much. Track your physical activity today so you can be aware of how much you move throughout the day!,0,0,0,0,0,0,0,0,1,0,1,0
"The more specific and measurable you can make your physical activity goals, the better chance you have of knowing whether you have met your goal! Is your physical activity goal specific and measurable?",0,0,0,0,0,0,0,0,1,0,0,0
"In the long run, it is best to have goals that are attainable and realistic. Is your physical activity goal one that you could sustain? If not, think about changing it!",0,0,0,0,0,0,0,0,1,0,1,0
"Have you noticed whether anything makes it easier for you to exercise? Is it a friend, a certain song, or a specifc routine? Whatever it is, write it down and try to use it for motivation today!",0,0,0,0,0,0,0,0,1,0,1,0
"What makes it more difficult for you to exercise? Is it weather, a bad mood, fatigue? Try brainstorming what your barriers are and writing down ways to problem-solve around them!",0,0,0,0,0,0,0,0,1,0,1,0
Is there a safe place nearby where you could walk or exercise? Try thinking of a spot where you don't normally go and explore a new part of your neighborhood today.,0,0,0,0,0,0,0,0,1,0,1,0
Adding variety into your routine is good for both the mind and the body. Why not try taking a walk along a different route today?,0,0,0,0,0,0,0,0,1,0,1,0
"Local parks, walking trails, or even indoor malls can be great places to take a walk. Try finding a new place to walk today!",0,0,0,0,0,0,0,0,1,0,1,0
Sometimes it's easier to stick with your exercise goals if you share them with a friend or family member who can help keep you on track. Can you tell someone you care about today about your physical activity goals?,0,0,0,0,0,0,0,0,1,0,1,1
Some people find that physical activity is more enjoyable when it is done with others. Try finding a friend or family member who can exercise with you this week!,0,0,0,0,0,0,0,0,1,0,1,1
"Many cities and towns have community centers, classes, gyms, and other resources for physical activity. This week, try looking into what resources you have in your community!",0,0,0,0,0,0,0,0,1,0,1,0
Setbacks and slips are a normal part of progress. What matters most is not giving up after a setback. Think of a time when you persevered through a setback and use that to motivate you today to meet your physical activity goal!,0,0,0,0,0,0,0,0,1,0,1,0
"Today, think of one way that you can make yourself less likely to experience setbacks with your physical activity goals in the future. Write it down and remember not to be hard on yourself if you do slip up; it happens to all of us!",0,0,0,0,0,0,0,0,1,0,1,0
"Sitting for several hours during the day can lead to reduced strength and energy over time. Today, try to get up every 30 minutes to move around!",0,0,0,0,0,0,0,0,1,0,1,0
"Reducing sitting or sedentary time can improve your energy level, help with pain and body aches, and reduce your risk of disease. Try to get up and move every half an hour today!",0,0,0,0,0,0,0,0,1,0,1,0
"Today, try to use a reminder system like a watch or phone alarm to help you remember to get up, stretch, and move every 30 to 60 minutes!",0,0,0,0,0,0,0,0,1,0,1,0
Sitting for prolonged periods of time can be bad for your heart and body. Try to find ways to get up and stretch often today!,0,0,0,0,0,0,0,0,1,0,1,0
"Today, think of three pros and three cons of having physical activity as a part of your daily routine. Do you want to exercise regularly? How might you do it?",0,0,0,0,0,0,0,0,1,0,1,0
Did you know that walking for even an additional 15 minutes per day can improve health and well-being? Try to take a walk today either alone or with a friend!,0,0,0,0,0,0,0,0,1,0,1,0
"Today, try to incorporate gratitude into your life. Stop for a few minutes and write down three good things that happened to you this week.",1,1,0,0,0,0,0,0,0,0,1,0
There are easy tricks you can use to increase your activity every day. Try parking farther away in a parking lot or taking the stairs instead of the elevator whenever you can!,0,0,0,0,0,0,0,0,1,0,1,0
"Try to perform an act of kindness for someone else today. It can be big or small, but notice what positive thoughts and feelings you have when you do it!",1,0,0,0,1,0,0,0,0,0,1,1
"The American Heart Association recommends walking as one of the most effective forms of exercise for achieving heart health. Walk whenever you can; in fact, try to take a walk today!",0,0,0,0,0,0,0,0,1,0,1,0
"Today, try to take a few minutes to express your gratitude to someone who has done something kind for you at some point in your life. You can write them a letter, call them, or thank them in person!",1,1,0,0,0,0,0,0,0,0,1,1
"People who schedule exercise time on their calendar like they would any other important appointment/task are more likely to stick with a physical activity plan. Can you schedule a time to exercise today, even if it's just a short walk?",0,0,0,0,0,0,0,0,1,0,1,0
